{"artifacts":{"instance/knowledge/KB.md":"4124204f66822f7f6d838a568a39b55566d4e619941e232f79f2881616c19c8a","instance/knowledge/approved-knowledge.v0.1.json":"c14f4dfea154d219fa6ca5058ca8f57cbde4ccccda8971e3a6fa3efefbc81e52","instance/system-prompt/SYSTEM_PROMPT.md":"9547ed290b7c24e822ee2f0fa5c021cdb34be8b910fecd7bd0396719326dd4a0","instance/tests/knowledge-tests.v0.1.json":"ff3606abaf047c8f5e1824003c67b0d48d37688bdb732a213b015e8bd165e807","instance/traceability/knowledge-traceability.v0.1.json":"350585639b2a21872365b38e075395873abc4cfc4c686f75526f672cb351f643"},"authority":{"deployment_authorized":false,"network_calls":0,"production_approved":false,"provider_calls":0,"runtime_installed":false},"bundle_sha256":"6d60526fd0ba0082a626bbc04ae7b85d678bced082ef91cd267fc9b4300b5503","entry_count":12,"mission_id":"draft-ava-home-services-concierge-20260826-014140-bb4a8c","report_sha256":"c070d4c3d5097e9cc2395a63f781f8fad5b5f03e5ab3cfef1ae55643a2b70eb2","schema_version":"0.1","status":"INSTANCE_KNOWLEDGE_BUILD_PASS","verification":{"checks":12,"failed":0,"status":"PASS"}}
